route_id,file,path_or_state,line_or_offset,evidence,classification,patchability,recommended_action
SCXML_ROUTE_001,root_content_ui_pausemenu_networking.sc.xml.decoded.xml,NetworkingLayerOffline / NetTabs,84-89,"Online NetTabs has avatar picker button: desc=mp_fe_avatarpicker_tab -> goto(NetConf_AvatarPicker)","existing online UI route","SCXML copy","Copy equivalent button into NetOfflineTabs for single-player/offline visibility."
SCXML_ROUTE_002,root_content_ui_pausemenu_networking.sc.xml.decoded.xml,NetworkingLayerOffline / NetOfflineTabs,140-184,"Offline tabs enter NetOfflineTabs and expose public/private/LAN, but no avatar picker button","missing offline UI route","SCXML insert","Variant A inserts avatar tab before LAN in NetOfflineTabs."
SCXML_ROUTE_003,root_content_ui_pausemenu_lobby_main.sc.xml.decoded.xml,NetConf_AvatarPicker,147-163,"MessageBox confirmation exits NetConf_AvatarPicker, calls NetMachine.LeavePosse, sends LaunchAvatarPicker, stackPush(HudSceneOnline)","existing event bridge","SCXML copy","Variant A copies this definition into networking.sc.xml so goto target exists outside lobby."
SCXML_ROUTE_004,root_content_ui_net_profileeditor_main.sc.xml.decoded.xml,MP_ProfileEditor,2-60,"Profile editor layer contains buttons for avatar, mount, title; avatar enters MP_AvatarGroupSelector","avatar picker surface","direct SCXML include candidate","Fallback B: include/enter MP_ProfileEditor if script event only sets a global and no runtime opens UI."
SCXML_ROUTE_005,root_content_ui_net_profileeditor_main.sc.xml.decoded.xml,MP_AvatarGroupSelector,60-130,"Scrollable avatar group selector with accept/cancel transitions","avatar selection menu","direct SCXML route candidate","Do not patch first; use as validation target after LaunchAvatarPicker event fires."
SCXML_ROUTE_006,root_content_ui_pausemenu_net_profile.sc.xml.decoded.xml,MPProfile / MPP_TitleValue / mount labels,3-56,"Profile display panel exists and is included by networking.sc.xml","profile display","already included","Use to confirm MP profile surface is visible when offline networking is opened."
